"Категорія","Підкатегорія","Назва","Ціна"
"Більярдні шари","Для піраміди","Бильярдный шар 60 мм","175"
"Більярдні шари","Для піраміди","Биток 68 мм цветной","245"
"Більярдні шари","Для піраміди","Биток Aramith Premier 68мм","1150"
"Більярдні шари","Для піраміди","Шар для русского бильярда 68мм","230"
"Більярдні шари","Для піраміди","Шар для русского бильярда Aramith Premier 68 мм","750"
"Більярдні шари","Для піраміди","Шары для  бильярда пирамиды Champion 60 мм","1800"
"Більярдні шари","Для піраміди","Шары для русского бильярда Aramith Premier 60 мм","6750"
"Більярдні шари","Для піраміди","Шары для русского бильярда Aramith Premier 68 мм","11440"
"Більярдні шари","Для піраміди","Шары для русского бильярда Aramith Standart 60 мм","6300"
"Більярдні шари","Для піраміди","Шары для русского бильярда Aramith Standart 68 мм","10800"
"Більярдні шари","Для піраміди","Шары для русского бильярда Aramith Super PRО 67 мм","14670"
"Більярдні шари","Для піраміди","Шары для русского бильярда Champion 68 мм","2100"
"Більярдні шари","Для піраміди","Биток 60 мм","190"
"Більярдні шари","Для піраміди","Биток Aramith Premier 68мм цветной","1060"
"Більярдні шари","Для піраміди","Биток Aramith Super Pro 67 мм","1920"
"Більярдні шари","Для піраміди","Тренировочный шар Aramith Jim Rempe Пул 57,2 мм","1390"
"Більярдні шари","Для піраміди","Шары для русского бильярда Champion Premium 68 мм","2450"
"Більярдні шари","Для американського пулу","Бильярдный шар для пула 57,2 мм","210"
"Більярдні шари","Для американського пулу","Биток для пула 57,2 мм","160"
"Більярдні шари","Для американського пулу","Шары для американского пула Aramith Premier 57,2 мм","6200"
"Більярдні шари","Для американського пулу","Шары для американского пула Champion Classic 57,2 мм","1300"
"Більярдні шари","Для американського пулу","Шары для американского пула Champion Premier 57,2 мм","2600"
"Більярдні шари","Для американського пулу","Шары для пула Champion Classic 60 мм","1750"
"Більярдні шари","Для американського пулу","Шары для пула бильярда Aramith Standart 57,2 мм","5900"
"Більярдні шари","Для американського пулу","Брелок Бильярдный шар пул","35"
"Більярдні шари","Для американського пулу","Шары для американского пула Aramith Super PRО 57,2 мм","11500"
"Більярдні шари","Для снукеру","Бильярдные шары для снукера Aramith Premier 52.4 мм","5950"
"Більярдні шари","Для снукеру","Шары для снукера Champion Snooker 52.4 мм","2550"
"Більярдні шари","Для снукеру","Бильярдные шары для снукера Champion Premium Snooker","2560"